id,created_at,images,blurb,owner,month,saved_notes,template
dd5ec7b7-233f-4b8c-9ab9-983c2af29a73,2026-02-06 21:46:47.848392+00,04ede62d-b65c-4fcd-b778-f4dec98374da;0693cf64-e9d5-4b8f-b3f3-45f4ea7385da;06fa5aee-ecb8-4639-a80e-24d760a1c51a;0967dfc2-3d82-4fe5-b31d-6f0d7ad2fc3b;0b18ce4b-e151-43a0-a1eb-af11946dc652;112c404a-2b15-4e16-b9d1-0fba58cf6dde,"February was full of cozy moments and big changes. Spent the first week snowed in with hot cocoa and good books. Mid-month brought a surprise visit from old friends—we laughed until 2am. Wrapped up with a weekend getaway to the mountains. So grateful for this month.",+12535149837,2,"[{""date"":""2026-03-05T14:00:00.000Z"",""note"":""Coffee catch-up with Sarah at the new café downtown""},{""date"":""2026-03-14T10:30:00.000Z"",""note"":""Book club meeting—discussing this month's pick""},{""date"":""2026-03-22T18:00:00.000Z"",""note"":""Birthday dinner for Mom at her favorite Italian spot""}]",0
062adab2-aee3-4e7f-88aa-fe1977509924,2026-02-06 21:43:35.764576+00,04ede62d-b65c-4fcd-b778-f4dec98374da;0693cf64-e9d5-4b8f-b3f3-45f4ea7385da,"A quieter month but meaningful. Focused on finishing the pottery class I started in January. Made a set of mugs I'm actually proud of. Lots of long walks and thinking. Sometimes less is more.",+17194327546,2,"[{""date"":""2026-03-08T09:00:00.000Z"",""note"":""Morning yoga session at the park""},{""date"":""2026-03-16T15:00:00.000Z"",""note"":""Pottery studio open house—showing my new pieces""},{""date"":""2026-03-28T12:00:00.000Z"",""note"":""Brunch with the girls before everyone scatters for spring""}]",1
03b344fe-8ef2-44f9-aedd-513692f289d4,2026-02-06 21:40:15.631122+00,06fa5aee-ecb8-4639-a80e-24d760a1c51a;0967dfc2-3d82-4fe5-b31d-6f0d7ad2fc3b;0b18ce4b-e151-43a0-a1eb-af11946dc652;112c404a-2b15-4e16-b9d1-0fba58cf6dde;1ce8c33f-4ec0-4deb-a8c2-60ec366a580c,"February flew by. Highlights: promoted at work (finally!), adopted a rescue pup named Biscuit, and hosted game night that turned into an impromptu karaoke session. The snowstorm gave us three unexpected days off—best surprise ever.",+12138549945,2,"[{""date"":""2026-03-03T11:00:00.000Z"",""note"":""Biscuit's first obedience class""},{""date"":""2026-03-11T19:00:00.000Z"",""note"":""Team dinner celebrating the Q1 launch""},{""date"":""2026-03-25T16:00:00.000Z"",""note"":""Spring cleaning and donating old clothes""}]",2
f153d2e7-deaa-4485-96e3-f1247cefc116,2026-02-06 21:37:11.755517+00,04ede62d-b65c-4fcd-b778-f4dec98374da;0693cf64-e9d5-4b8f-b3f3-45f4ea7385da,"Short month, big feelings. Said goodbye to my childhood home as my parents downsized. Found a box of letters from high school—couldn't stop reading. Also ran my first half marathon. Emotional but proud.",+19331835889,2,"[{""date"":""2026-03-07T08:00:00.000Z"",""note"":""Sunday farmers market—stocking up on spring produce""},{""date"":""2026-03-15T20:00:00.000Z"",""note"":""Concert at the Ryman with old college friends""},{""date"":""2026-03-24T14:00:00.000Z"",""note"":""Helping Dad set up his new garden""}]",1
9beac5c6-2476-4b03-acca-0f6da97de7d9,2026-02-06 21:30:31.140764+00,06fa5aee-ecb8-4639-a80e-24d760a1c51a;0967dfc2-3d82-4fe5-b31d-6f0d7ad2fc3b;0b18ce4b-e151-43a0-a1eb-af11946dc652;112c404a-2b15-4e16-b9d1-0fba58cf6dde;1ce8c33f-4ec0-4deb-a8c2-60ec366a580c,"Wedding planning chaos in the best way. Cake tastings, venue visits, and too many Pinterest boards. Also squeezed in a ski trip with the bridal party. February was a blur of love and logistics.",+18910321998,2,"[{""date"":""2026-03-06T13:00:00.000Z"",""note"":""Final dress fitting with Mom and bridesmaids""},{""date"":""2026-03-18T17:00:00.000Z"",""note"":""Menu tasting at the reception venue""},{""date"":""2026-03-30T10:00:00.000Z"",""note"":""Bachelorette weekend begins!""}]",2
b878db19-5859-43e6-89d9-19bd19260217,2026-02-06 21:29:34.297001+00,04ede62d-b65c-4fcd-b778-f4dec98374da;0693cf64-e9d5-4b8f-b3f3-45f4ea7385da;06fa5aee-ecb8-4639-a80e-24d760a1c51a;0967dfc2-3d82-4fe5-b31d-6f0d7ad2fc3b;0b18ce4b-e151-43a0-a1eb-af11946dc652,"Kept it simple. Lots of cooking new recipes—finally mastered sourdough. Weekly calls with Grandma. Tried ice fishing for the first time (cold but fun). February reminded me to slow down and enjoy the small stuff.",+13327437789,2,"[{""date"":""2026-03-04T07:30:00.000Z"",""note"":""Early morning run—training for 10K""},{""date"":""2026-03-19T18:30:00.000Z"",""note"":""Dinner party—hosting the neighbors""},{""date"":""2026-03-27T09:00:00.000Z"",""note"":""Planting the vegetable garden for spring""}]",2
